{"experiment": 0, "game": "twenty_fourty_eight", "evaluation_score": 5.3199999034404755, "game_score": 1064.0, "steps": 125, "runtime_min": 31.041883039474488, "status": "KEEP", "description": "Stage C v2 \u2014 richer event template, 5 iters | iter 1 | no param changes | param: Action imbalance {'up': 0.34, 'down': 0.12, 'left': 0.42, 'right': 0.11} \u2014 more fallback for diversity", "notes": "max_eval=5.32, 0 episodes, 125 steps. Improved from 0.00", "tags": ["cognitive_check_v2"], "wandb_url": "https://wandb.ai/chaleong/orak-2048/runs/20260429_114511_orak-2048", "timestamp": "2026-04-29T12:16:14.630691", "config_name": "gemma"}
{"experiment": 1, "game": "twenty_fourty_eight", "evaluation_score": 1.8799999728798866, "game_score": 216.0, "steps": 108, "runtime_min": 13.984297720591227, "status": "DISCARD", "description": "Stage C v2 \u2014 richer event template, 5 iters | iter 2 | no param changes | param: Score plateau 3 eps \u2014 refine procedures faster; param: Score plateau 3 eps \u2014 need fewer failures to refine; param: Max tile 32 \u2014 faster procedure activation", "notes": "max_eval=1.88, 1 episodes, 108 steps. Below best 5.32", "tags": ["cognitive_check_v2"], "wandb_url": "https://wandb.ai/chaleong/orak-2048/runs/20260429_121618_orak-2048", "timestamp": "2026-04-29T12:30:18.166084", "config_name": "gemma"}
{"experiment": 2, "game": "twenty_fourty_eight", "evaluation_score": 4.399999976158142, "game_score": 880.0, "steps": 80, "runtime_min": 11.142143829663594, "status": "DISCARD", "description": "Stage C v2 \u2014 richer event template, 5 iters | iter 3 | twenty: max_theta=0.625, min_theta=0.185, \u03b8_base=0.2, warmup_steps=13 | param: Action imbalance {'up': 0.34, 'down': 0.09, 'left': 0.47, 'right': 0.1} \u2014 more fallback for diversity; param: Max tile 64 \u2014 faster procedure activation", "notes": "max_eval=4.40, 0 episodes, 80 steps. Below best 5.32", "tags": ["cognitive_check_v2"], "wandb_url": "https://wandb.ai/chaleong/orak-2048/runs/20260429_123022_orak-2048", "timestamp": "2026-04-29T12:41:31.209817", "config_name": "gemma"}
{"experiment": 3, "game": "twenty_fourty_eight", "evaluation_score": 6.459999829530716, "game_score": 12.0, "steps": 177, "runtime_min": 31.015860307216645, "status": "KEEP", "description": "Stage C v2 \u2014 richer event template, 5 iters | iter 5 | twenty: max_theta=0.525, min_theta=0.145, warmup_steps=7 | param: Stagnation \u2014 decay theta faster for exploration", "notes": "max_eval=6.46, 2 episodes, 177 steps. Improved from 5.32", "tags": ["cognitive_check_v2"], "wandb_url": "https://wandb.ai/chaleong/orak-2048/runs/20260429_124212_orak-2048", "timestamp": "2026-04-29T13:13:13.915958", "config_name": "gemma"}
