{"experiment": 1, "variant": "stage_a_2048", "game": "twenty_fourty_eight", "evaluation_score": 54.54545593261719, "game_score": 54.54545593261719, "steps": 300, "runtime_min": 22.0, "status": "BASELINE", "description": "stage_a_2048: Stage A 2048 26B-AWQ: vmem OFF, planner OFF \u2014 model-only baseline (post-#46 units)", "notes": "max_eval=54.55 (log2 max_tile units, post-#46), 1 ep, 300 steps", "tags": ["pr31_2048_rerun", "stage_a_2048"], "wandb_url": "", "timestamp": "2026-05-10T16:19:58.175046+00:00", "config_name": "gemma_26b", "_source_path": "experiments/pr31_2048_rerun/gemma_26b/results.jsonl"}
{"experiment": 2, "variant": "stage_c_2048", "game": "twenty_fourty_eight", "evaluation_score": 54.54545593261719, "game_score": 54.54545593261719, "steps": 300, "runtime_min": 22.0, "status": "DISCARD", "description": "stage_c_2048: Stage C 2048 26B-AWQ: vmem ON, planner OFF \u2014 isolate vector memory contribution (post-#46 units)", "notes": "max_eval=54.55 (log2 max_tile units, post-#46), 5 ep, 300 steps", "tags": ["pr31_2048_rerun", "stage_c_2048"], "wandb_url": "", "timestamp": "2026-05-10T16:42:50.115510+00:00", "config_name": "gemma_26b", "_source_path": "experiments/pr31_2048_rerun/gemma_26b/results.jsonl"}
{"experiment": 3, "variant": "stage_d_2048", "game": "twenty_fourty_eight", "evaluation_score": 63.6363639831543, "game_score": 63.6363639831543, "steps": 300, "runtime_min": 36.0, "status": "KEEP", "description": "stage_d_2048: Stage D 2048 26B-AWQ: vmem ON, planner ON \u2014 full stack (post-#46 units)", "notes": "max_eval=63.64 (log2 max_tile units, post-#46), 3 ep, 300 steps", "tags": ["pr31_2048_rerun", "stage_d_2048"], "wandb_url": "", "timestamp": "2026-05-10T17:18:52.180936+00:00", "config_name": "gemma_26b", "_source_path": "experiments/pr31_2048_rerun/gemma_26b/results.jsonl"}
{"experiment": 4, "variant": "stage_b_2048", "game": "twenty_fourty_eight", "evaluation_score": 63.6363639831543, "game_score": 63.6363639831543, "steps": 300, "runtime_min": 44.0, "status": "DISCARD", "description": "stage_b_2048: Stage B 2048 26B-AWQ: vmem OFF, planner ON \u2014 isolate planner contribution (post-#46 units)", "notes": "max_eval=63.64 (log2 max_tile units, post-#46), 3 ep, 300 steps", "tags": ["pr31_2048_rerun", "stage_b_2048"], "wandb_url": "", "timestamp": "2026-05-11T12:05:26.483671+00:00", "config_name": "gemma_26b", "_source_path": "experiments/pr31_2048_rerun/gemma_26b/results.jsonl"}
{"experiment": 1, "variant": "stage_d_26b", "game": "pokemon_red", "evaluation_score": 57.14285714285714, "game_score": 4.0, "steps": 300, "runtime_min": 55.8, "status": "BASELINE", "description": "stage_d_26b: Stage D 26B (vmem ON, planner ON) \u2014 original PR #31 rerun on rebased master", "notes": "max_eval=57.14 (4.0/7), 1 ep, 300 steps", "tags": ["pr31_ablation_26b", "stage_d_26b"], "wandb_url": "https://wandb.ai/chaleong/orak-pokemon-red/runs/pr31_rerun_pokemon_20260508T181055Z_orak-pokemon-red", "timestamp": "2026-05-08T20:19:53.585654+00:00", "config_name": "gemma_26b", "_source_path": "experiments/pr31_ablation_26b/gemma_26b/results.jsonl"}
{"experiment": 2, "variant": "stage_a_26b", "game": "pokemon_red", "evaluation_score": 28.57142857142857, "game_score": 2.0, "steps": 300, "runtime_min": 60.0, "status": "DISCARD", "description": "stage_a_26b: Stage A 26B (vmem OFF, planner OFF) \u2014 model-only baseline", "notes": "max_eval=28.57 (2.0/7), 1 ep, 300 steps", "tags": ["pr31_ablation_26b", "stage_a_26b"], "wandb_url": "", "timestamp": "2026-05-08T20:19:53.628634+00:00", "config_name": "gemma_26b", "_source_path": "experiments/pr31_ablation_26b/gemma_26b/results.jsonl"}
{"experiment": 3, "variant": "stage_c_26b", "game": "pokemon_red", "evaluation_score": 0.0, "game_score": 0.0, "steps": 300, "runtime_min": 62.0, "status": "DISCARD", "description": "stage_c_26b: Stage C 26B: vmem ON, planner OFF \u2014 isolate vector memory contribution", "notes": "max_eval=0.00 (0.0/7), 1 ep, 300 steps", "tags": ["pr31_ablation_26b", "stage_c_26b"], "wandb_url": "", "timestamp": "2026-05-09T01:15:37.870262+00:00", "config_name": "gemma_26b", "_source_path": "experiments/pr31_ablation_26b/gemma_26b/results.jsonl"}
{"experiment": 4, "variant": "stage_b_26b", "game": "pokemon_red", "evaluation_score": 57.14285714285714, "game_score": 4.0, "steps": 300, "runtime_min": 46.0, "status": "DISCARD", "description": "stage_b_26b: Stage B 26B: vmem OFF, planner ON \u2014 isolate subtask planner contribution", "notes": "max_eval=57.14 (4.0/7), 1 ep, 300 steps", "tags": ["pr31_ablation_26b", "stage_b_26b"], "wandb_url": "", "timestamp": "2026-05-09T02:01:52.918764+00:00", "config_name": "gemma_26b", "_source_path": "experiments/pr31_ablation_26b/gemma_26b/results.jsonl"}
{"experiment": 5, "variant": "stage_d_plus_26b", "game": "pokemon_red", "evaluation_score": 71.42857142857143, "game_score": 5.0, "steps": 600, "runtime_min": 101.0, "status": "KEEP", "description": "stage_d_plus_26b: Stage D++ 26B: vmem ON, planner ON, 600 steps + grace=10 \u2014 extend Stage D's 57.14% with longer runtime", "notes": "max_eval=71.43 (5.0/7), 1 ep, 600 steps", "tags": ["pr31_ablation_26b", "stage_d_plus_26b"], "wandb_url": "", "timestamp": "2026-05-09T03:42:55.143388+00:00", "config_name": "gemma_26b", "_source_path": "experiments/pr31_ablation_26b/gemma_26b/results.jsonl"}
{"experiment": 6, "variant": "stage_c_26b_mmr_decay", "game": "pokemon_red", "evaluation_score": 28.57142857142857, "game_score": 2.0, "steps": 300, "runtime_min": 56.0, "status": "DISCARD", "description": "stage_c_26b_mmr_decay: Stage C retest 26B: vmem ON + MMR + decay (alpha=0.5, lambda=0.5), planner OFF \u2014 validate PR #60 breaks the retrieval reinforcement loop", "notes": "max_eval=28.57 (2.0/7), 1 ep, 300 steps", "tags": ["pr31_ablation_26b", "stage_c_26b_mmr_decay"], "wandb_url": "", "timestamp": "2026-05-10T13:29:10.911845+00:00", "config_name": "gemma_26b", "_source_path": "experiments/pr31_ablation_26b/gemma_26b/results.jsonl"}
{"experiment": 7, "variant": "stage_c_plus_26b_mmr_decay", "game": "pokemon_red", "evaluation_score": 0.0, "game_score": 0.0, "steps": 288, "runtime_min": 70.0, "status": "EARLY_KILL", "description": "stage_c_plus_26b_mmr_decay: Stage C++ retest 26B: vmem ON + MMR + decay, planner OFF, 600 steps target \u2014 killed at 288 steps after n=1 LLM-sampling-variance diagnosis (warps all to (7,1) staircase, exit door never sampled)", "notes": "max_eval=0.00 (0.0/7), 1 ep, 288 steps (killed early); 6 warps all to (7,1), 138/212 move_to to (5,4), 10 distinct (x,y) \u2014 same wedge as Stage C baseline. Diagnosis: stochastic divergence at step 8 between Stage C\u2032 (lucky escape) and this run (unlucky); MMR+decay mechanism didn't differentiate.", "tags": ["pr31_ablation_26b", "stage_c_plus_26b_mmr_decay"], "wandb_url": "", "timestamp": "2026-05-10T15:46:00.000000+00:00", "config_name": "gemma_26b", "_source_path": "experiments/pr31_ablation_26b/gemma_26b/results.jsonl"}
{"experiment": 8, "variant": "stage_a_obs_fix", "game": "pokemon_red", "evaluation_score": 0.0, "game_score": 0.0, "steps": 158, "runtime_min": 35.0, "status": "EARLY_KILL", "description": "stage_a_obs_fix: Stage A 26B + obs preprocessor (PR #61): vmem OFF, planner OFF, 300 steps target \u2014 killed at 158 steps. Preprocessor active ([Full Map] in prompt + map memory accumulating), but agent stayed at y<5 on RedsHouse1f so y\u22656 rows stayed '?' \u2014 never saw the exit warp.", "notes": "max_eval=0.00 (0.0/7), 1 ep, 158 steps (killed early); 10 warps all to (7,1). Diagnosis: obs preprocessor is necessary-not-sufficient \u2014 accumulates what the screen window covers but can't reveal tiles the agent has never observed. Needs exploration nudge or planner to push the agent toward unexplored regions.", "tags": ["pr31_ablation_26b", "stage_a_obs_fix"], "wandb_url": "", "timestamp": "2026-05-11T11:19:00.000000+00:00", "config_name": "gemma_26b", "_source_path": "experiments/pr31_ablation_26b/gemma_26b/results.jsonl"}
{"experiment": 9, "variant": "stage_c_plus_26b_mmr_decay_t03", "game": "pokemon_red", "evaluation_score": 0.0, "game_score": 0.0, "steps": 263, "runtime_min": 51.0, "status": "EARLY_KILL", "description": "stage_c_plus_26b_mmr_decay_t03: Stage C\u2032++ at temperature=0.3 (down from 0.7) \u2014 test whether lower sampling temp lets the LLM act on the explicit exit-at-(2,7)/(3,7) prompt hint", "notes": "max_eval=0.00 (0.0/7), 1 ep, 263 steps (killed early). KEY FINDING: T=0.3 DID change spatial behavior \u2014 move_to(3,7)\u00d730, move_to(2,7)\u00d718 (was zero at T=0.7), so the LLM now attends to the location hint. But no successful warp through the exit door \u2014 agent walks TO (3,7) but never calls warp_with_warp_point(3,7); only 6 warps total, all to (7,1) staircase. Temperature fixes location-targeting failure mode but exposes a deeper tool-selection failure: action LLM uses move_to where warp_with_warp_point is required.", "tags": ["pr31_ablation_26b", "stage_c_plus_26b_mmr_decay_t03"], "wandb_url": "", "timestamp": "2026-05-11T13:21:00.000000+00:00", "config_name": "gemma_26b", "_source_path": "experiments/pr31_ablation_26b/gemma_26b/results.jsonl"}
{"experiment": 10, "variant": "stage_d_26b_self_reflect", "game": "pokemon_red", "evaluation_score": 57.14285714285714, "game_score": 4.0, "steps": 300, "runtime_min": 48.0, "status": "DISCARD", "description": "stage_d_26b_self_reflect: Stage D pokemon + self-reflection (PR #62): vmem ON + planner ON + reflect_every=10 \u2014 test whether periodic critique lifts the 57.14% Stage D baseline", "notes": "max_eval=57.14 (4.0/7), 1 ep, 300 steps", "tags": ["pr31_ablation_26b", "stage_d_26b_self_reflect"], "wandb_url": "", "timestamp": "2026-05-11T15:14:49.074451+00:00", "config_name": "gemma_26b", "_source_path": "experiments/pr31_ablation_26b/gemma_26b/results.jsonl"}
{"experiment": 1, "variant": "stage_a_mario", "game": "super_mario", "evaluation_score": 44.504966735839844, "game_score": 44.504966735839844, "steps": 300, "runtime_min": 3.0, "status": "BASELINE", "description": "stage_a_mario: Stage A mario 26B-AWQ: vmem OFF, planner OFF \u2014 model-only baseline", "notes": "max_eval=44.50, 24 ep, 300 steps", "tags": ["pr31_mario_rerun", "stage_a_mario"], "wandb_url": "", "timestamp": "2026-05-11T13:25:47.159985+00:00", "config_name": "gemma_26b", "_source_path": "experiments/pr31_mario_rerun/gemma_26b/results.jsonl"}
{"experiment": 2, "variant": "stage_b_mario", "game": "super_mario", "evaluation_score": 61.26241683959961, "game_score": 61.26241683959961, "steps": 300, "runtime_min": 6.0, "status": "KEEP", "description": "stage_b_mario: Stage B mario 26B-AWQ: vmem OFF, planner ON \u2014 isolate planner contribution", "notes": "max_eval=61.26, 7 ep, 300 steps", "tags": ["pr31_mario_rerun", "stage_b_mario"], "wandb_url": "", "timestamp": "2026-05-11T13:32:25.913149+00:00", "config_name": "gemma_26b", "_source_path": "experiments/pr31_mario_rerun/gemma_26b/results.jsonl"}
{"experiment": 3, "variant": "stage_c_mario", "game": "super_mario", "evaluation_score": 35.1810302734375, "game_score": 35.1810302734375, "steps": 300, "runtime_min": 3.0, "status": "DISCARD", "description": "stage_c_mario: Stage C mario 26B-AWQ: vmem ON, planner OFF \u2014 isolate vmem contribution", "notes": "max_eval=35.18, 16 ep, 300 steps", "tags": ["pr31_mario_rerun", "stage_c_mario"], "wandb_url": "", "timestamp": "2026-05-11T13:35:54.099275+00:00", "config_name": "gemma_26b", "_source_path": "experiments/pr31_mario_rerun/gemma_26b/results.jsonl"}
{"experiment": 4, "variant": "stage_d_mario", "game": "super_mario", "evaluation_score": 35.21307373046875, "game_score": 35.21307373046875, "steps": 300, "runtime_min": 5.0, "status": "DISCARD", "description": "stage_d_mario: Stage D mario 26B-AWQ: vmem ON, planner ON \u2014 full stack", "notes": "max_eval=35.21, 8 ep, 300 steps", "tags": ["pr31_mario_rerun", "stage_d_mario"], "wandb_url": "", "timestamp": "2026-05-11T13:41:01.756717+00:00", "config_name": "gemma_26b", "_source_path": "experiments/pr31_mario_rerun/gemma_26b/results.jsonl"}
