{"experiment": 0, "game": "super_mario", "evaluation_score": 29.38, "game_score": 300, "steps": 25, "status": "BASELINE", "description": "defaults: max_theta=0.45, min_theta=0.25, warmup=200", "notes": "0 bayesian selections, 100% fallback. Procedures learned but never executed.", "wandb_url": "https://wandb.ai/chaleong/orak-super-mario/runs/20260328_124356_orak-super-mario", "timestamp": "2026-03-28T12:43:56", "runtime_min": 15, "tags": ["macla"]}
{"experiment": 0, "game": "twenty_fourty_eight", "evaluation_score": 2.88, "game_score": 576, "steps": 76, "status": "BASELINE", "description": "defaults: max_theta=0.45, min_theta=0.25, warmup=200", "notes": "0 bayesian selections. eval=(576/20000)*100=2.88%.", "wandb_url": "https://wandb.ai/chaleong/orak-2048/runs/20260328_124356_orak-2048", "timestamp": "2026-03-28T12:43:56", "runtime_min": 15, "tags": ["macla"]}
{"experiment": 0, "game": "pokemon_red", "evaluation_score": 57.14, "game_score": 4, "steps": 93, "status": "BASELINE", "description": "defaults: max_theta=0.45, min_theta=0.25, warmup=200", "notes": "0 bayesian selections, all fallback. eval=(4/7)*100=57.14%.", "wandb_url": "https://wandb.ai/chaleong/orak-pokemon-red/runs/20260328_124356_orak-pokemon-red", "timestamp": "2026-03-28T12:43:56", "runtime_min": 15, "tags": ["macla"]}
{"experiment": 1, "game": "super_mario", "evaluation_score": 35.18, "game_score": 0, "steps": 3967, "status": "DISCARD", "description": "lower theta: max=0.30, min=0.10, warmup=100", "notes": "STUCK: 100 episodes, ceiling at 35.18%. Dies at pit (x=1135). 0 episodes improved. Bayesian selection 98% but procedures not handling pit.", "wandb_url": "https://wandb.ai/chaleong/orak-super-mario/runs/20260328_131021_orak-super-mario", "timestamp": "2026-03-28T13:10:21", "runtime_min": 30, "tags": ["macla"]}
{"experiment": 1, "game": "twenty_fourty_eight", "evaluation_score": 8.96, "game_score": 1792, "steps": 260, "status": "KEEP", "description": "lower theta: max=0.30, min=0.10, warmup=100", "notes": "Improved eval 2.88%\u21928.96%, game_score 576\u21921792. Still in first episode.", "wandb_url": "https://wandb.ai/chaleong/orak-2048/runs/20260328_131021_orak-2048", "timestamp": "2026-03-28T13:10:21", "runtime_min": 30, "tags": ["macla"]}
{"experiment": 1, "game": "pokemon_red", "evaluation_score": 42.86, "game_score": 3, "steps": 265, "status": "DISCARD", "description": "lower theta: max=0.30, min=0.10, warmup=100", "notes": "Regressed from baseline 57%\u219243% (4\u21923 flags). Lower theta caused bad procedure execution.", "wandb_url": "https://wandb.ai/chaleong/orak-pokemon-red/runs/20260328_131021_orak-pokemon-red", "timestamp": "2026-03-28T13:10:21", "runtime_min": 30, "tags": ["macla"]}
{"experiment": 3, "game": "super_mario", "evaluation_score": 44.09, "game_score": 0, "steps": 2145, "status": "DISCARD", "description": "gemini-2.5-flash, max_theta=0.20, asymmetric refinement, fatal context penalty", "notes": "DISCARD: flash broke 35% ceiling (44%) but regressed to 21%. Much worse reasoning quality.", "wandb_url": "https://wandb.ai/chaleong/orak-super-mario/runs/20260328_145501_orak-super-mario", "timestamp": "2026-03-28T14:57:22.086484", "runtime_min": 20, "tags": ["macla"]}
{"experiment": 3, "game": "twenty_fourty_eight", "evaluation_score": 7.0, "game_score": 228, "steps": 215, "status": "DISCARD", "description": "gemini-2.5-flash, max_theta=0.20, asymmetric refinement, fatal context penalty", "notes": "DISCARD: flash produced much worse decisions. eval 8.96%\u21920.07%, game 1792\u2192228.", "wandb_url": "https://wandb.ai/chaleong/orak-2048/runs/20260328_145501_orak-2048", "timestamp": "2026-03-28T14:57:22.086484", "runtime_min": 20, "tags": ["macla"]}
{"experiment": 3, "game": "pokemon_red", "evaluation_score": 14.29, "game_score": 1, "steps": 156, "status": "DISCARD", "description": "gemini-2.5-flash, max_theta=0.20, asymmetric refinement, fatal context penalty", "notes": "DISCARD: flash regression 42.86%\u219214.29% (3\u21921 flags). Reasoning quality too low.", "wandb_url": "https://wandb.ai/chaleong/orak-pokemon-red/runs/20260328_145501_orak-pokemon-red", "timestamp": "2026-03-28T14:57:22.086484", "runtime_min": 20, "tags": ["macla"]}
{"experiment": 4, "game": "super_mario", "evaluation_score": 47.16, "game_score": 200, "steps": 4995, "status": "KEEP", "description": "gemini-2.5-pro + thinking:high + MACLA fixes (max_theta=0.20, asymmetric refine, fatal penalty)", "notes": "BEST Mario: 47.16%! Broke 35% ceiling. pro+thinking+MACLA fixes.", "wandb_url": "https://wandb.ai/chaleong/orak-super-mario/runs/20260328_152226_orak-super-mario", "timestamp": "2026-03-28T15:22:23.162791", "runtime_min": 90, "tags": ["macla"]}
{"experiment": 4, "game": "twenty_fourty_eight", "evaluation_score": 6.0, "game_score": 1200, "steps": 124, "status": "DISCARD", "description": "gemini-2.5-pro + thinking:high + MACLA fixes (max_theta=0.20, asymmetric refine, fatal penalty)", "notes": "Below exp 1 best (8.96%). game_score=1200 vs 1792.", "wandb_url": "https://wandb.ai/chaleong/orak-2048/runs/20260328_152226_orak-2048", "timestamp": "2026-03-28T15:22:23.162791", "runtime_min": 90, "tags": ["macla"]}
{"experiment": 4, "game": "pokemon_red", "evaluation_score": 42.86, "game_score": 3, "steps": 145, "status": "DISCARD", "description": "gemini-2.5-pro + thinking:high + MACLA fixes (max_theta=0.20, asymmetric refine, fatal penalty)", "notes": "3 flags (42.86%) below baseline 57.14%.", "wandb_url": "https://wandb.ai/chaleong/orak-pokemon-red/runs/20260328_152226_orak-pokemon-red", "timestamp": "2026-03-28T15:22:23.162791", "runtime_min": 90, "tags": ["macla"]}
{"experiment": 5, "game": "super_mario", "evaluation_score": 35.18, "game_score": 0, "steps": 253, "status": "DISCARD", "runtime_min": 5, "description": "UnifiedMaclaAgent + gemini-2.5-pro + adaptive theta + use_tool fix", "notes": "35% max. Below exp 4 best (47%). Unified agent needs more tuning.", "wandb_url": "https://wandb.ai/chaleong/orak-super-mario/runs/20260403_203447_orak-super-mario", "timestamp": "2026-04-06T21:29:42.707650", "tags": ["macla"]}
{"experiment": 5, "game": "pokemon_red", "evaluation_score": 14.29, "game_score": 1, "steps": 49, "status": "DISCARD", "runtime_min": 5, "description": "UnifiedMaclaAgent + gemini-2.5-pro + use_tool fix + adaptive theta", "notes": "1 flag (14%). use_tool working but below baseline (57%).", "wandb_url": "https://wandb.ai/chaleong/orak-pokemon-red/runs/20260403_203447_orak-pokemon-red", "timestamp": "2026-04-06T21:29:42.707650", "tags": ["macla"]}
{"experiment": 5, "game": "twenty_fourty_eight", "evaluation_score": 0.0, "game_score": 0, "steps": 10, "status": "DISCARD", "runtime_min": 5, "description": "UnifiedMaclaAgent + gemini-2.5-pro + adaptive theta", "notes": "Too few steps to evaluate. Thread crash from weave.init per-call.", "tags": ["macla"], "wandb_url": "https://wandb.ai/chaleong/orak-2048/runs/20260403_203447_orak-2048", "timestamp": "2026-04-07T21:34:30.437619"}
{"experiment": 5, "game": "super_mario", "evaluation_score": 21.851970672607422, "game_score": 0.0, "steps": 1450, "runtime_min": 0.0, "status": "DISCARD", "description": "E6: UnifiedMacla + per-game theta + warmup + early stop", "notes": "max_eval=21.85, 99 episodes, 1450 steps. Below best 47.16", "tags": ["macla"], "wandb_url": "https://wandb.ai/chaleong/orak-super-mario/runs/20260422_213143_orak-super-mario", "timestamp": "2026-04-22T22:12:45.369174"}
{"experiment": 5, "game": "twenty_fourty_eight", "evaluation_score": 2.02, "game_score": 0.0, "steps": 1108, "runtime_min": 0.0, "status": "DISCARD", "description": "E6: UnifiedMacla + per-game theta + warmup + early stop", "notes": "max_eval=0.02, 99 episodes, 1108 steps. Below best 8.96", "tags": ["macla"], "wandb_url": "https://wandb.ai/chaleong/orak-2048/runs/20260422_213143_orak-2048", "timestamp": "2026-04-22T22:12:45.369644"}
{"experiment": 5, "game": "pokemon_red", "evaluation_score": 14.29, "game_score": 0.0, "steps": 250, "runtime_min": 0.0, "status": "DISCARD", "description": "E6: UnifiedMacla + per-game theta + warmup + early stop", "notes": "max_eval=1.00, 1 episodes, 250 steps. Below best 57.14", "tags": ["macla"], "wandb_url": "https://wandb.ai/chaleong/orak-pokemon-red/runs/20260422_213143_orak-pokemon-red", "timestamp": "2026-04-22T22:12:45.369932"}
{"experiment": 6, "game": "super_mario", "evaluation_score": 47.228450775146484, "game_score": 0.0, "steps": 182, "runtime_min": 0.0, "status": "KEEP", "description": "auto iter 1: \u03b8_base\u2191, warmup\u2191 (pre-trajectory-analysis)", "notes": "max_eval=47.23, 10 episodes, 182 steps. Improved from 47.16", "tags": ["macla"], "wandb_url": "https://wandb.ai/chaleong/orak-super-mario/runs/20260422_231949_orak-super-mario", "timestamp": "2026-04-23T00:10:32.817304"}
{"experiment": 6, "game": "twenty_fourty_eight", "evaluation_score": 0.98, "game_score": 196.0, "steps": 36, "runtime_min": 0.0, "status": "DISCARD", "description": "auto iter 1: \u03b8_base\u2191, warmup\u2191 (pre-trajectory-analysis)", "notes": "max_eval=0.01, 0 episodes, 36 steps. Below best 8.96", "tags": ["macla"], "wandb_url": "https://wandb.ai/chaleong/orak-2048/runs/20260422_231949_orak-2048", "timestamp": "2026-04-23T00:10:32.818710"}
{"experiment": 6, "game": "pokemon_red", "evaluation_score": 14.29, "game_score": 1.0, "steps": 114, "runtime_min": 0.0, "status": "DISCARD", "description": "auto iter 1: \u03b8_base\u2191, warmup\u2191 (pre-trajectory-analysis)", "notes": "max_eval=1.00, 0 episodes, 114 steps. Below best 57.14", "tags": ["macla"], "wandb_url": "https://wandb.ai/chaleong/orak-pokemon-red/runs/20260422_231949_orak-pokemon-red", "timestamp": "2026-04-23T00:10:32.819263"}
{"experiment": 7, "game": "super_mario", "evaluation_score": 44.280677795410156, "game_score": 0.0, "steps": 218, "runtime_min": 0.0, "status": "DISCARD", "description": "auto iter 2: \u03b8_base\u2191 continued, warmup=8", "notes": "max_eval=44.28, 5 episodes, 218 steps. Below best 47.23", "tags": ["macla"], "wandb_url": "https://wandb.ai/chaleong/orak-super-mario/runs/20260423_001447_orak-super-mario", "timestamp": "2026-04-23T20:24:09.034362"}
{"experiment": 7, "game": "twenty_fourty_eight", "evaluation_score": 2.3, "game_score": 0.0, "steps": 138, "runtime_min": 0.0, "status": "DISCARD", "description": "auto iter 2: \u03b8_base\u2191 continued, warmup=8", "notes": "max_eval=0.02, 5 episodes, 138 steps. Below best 8.96", "tags": ["macla"], "wandb_url": "https://wandb.ai/chaleong/orak-2048/runs/20260423_001447_orak-2048", "timestamp": "2026-04-23T20:24:09.034704"}
{"experiment": 7, "game": "pokemon_red", "evaluation_score": 14.29, "game_score": 0.0, "steps": 200, "runtime_min": 0.0, "status": "DISCARD", "description": "auto iter 2: \u03b8_base\u2191 continued, warmup=8", "notes": "max_eval=1.00, 0 episodes, 200 steps. Below best 57.14", "tags": ["macla"], "wandb_url": "https://wandb.ai/chaleong/orak-pokemon-red/runs/20260423_001447_orak-pokemon-red", "timestamp": "2026-04-23T20:24:09.034927"}
{"experiment": 8, "game": "super_mario", "evaluation_score": 47.164371490478516, "game_score": 0.0, "steps": 252, "runtime_min": 0.0, "status": "DISCARD", "description": "OnlineAgentEvaluator + gemini-2.5-pro + shaped rewards", "notes": "max_eval=47.16, 14 episodes, 252 steps. Below best 47.23", "tags": ["macla"], "wandb_url": "https://wandb.ai/chaleong/orak-super-mario/runs/20260423_205937_orak-super-mario", "timestamp": "2026-04-23T21:33:19.118666"}
{"experiment": 8, "game": "twenty_fourty_eight", "evaluation_score": 2.52, "game_score": 504.0, "steps": 70, "runtime_min": 0.0, "status": "DISCARD", "description": "OnlineAgentEvaluator + gemini-2.5-pro + shaped rewards", "notes": "max_eval=0.03, 0 episodes, 70 steps. Below best 8.96", "tags": ["macla"], "wandb_url": "https://wandb.ai/chaleong/orak-2048/runs/20260423_205937_orak-2048", "timestamp": "2026-04-23T21:33:19.119276"}
{"experiment": 8, "game": "pokemon_red", "evaluation_score": 57.14, "game_score": 4.0, "steps": 46, "runtime_min": 0.0, "status": "DISCARD", "description": "OnlineAgentEvaluator + gemini-2.5-pro + shaped rewards", "notes": "max_eval=4.00, 0 episodes, 46 steps. Below best 57.14", "tags": ["macla"], "wandb_url": "https://wandb.ai/chaleong/orak-pokemon-red/runs/20260423_205937_orak-pokemon-red", "timestamp": "2026-04-23T21:33:19.119648"}
